{
  "schema": "ao.architecture.autonomous-issue-repair.governance-decision.v1",
  "run_id": "repair-run-20260728",
  "repository": "example/repair-fixture",
  "base_sha": "1111111111111111111111111111111111111111",
  "head_sha": "bbbbbbbbbbbbbbbbbbbbbbbbbbbbbbbbbbbbbbbb",
  "governance_class": "external",
  "classification_sources": [
    "repository_policy",
    "branch_rules",
    "codeowners",
    "operator_envelope"
  ],
  "push_target": "operator_owned_fork",
  "pull_request_mode": "upstream_draft_only",
  "merge": {
    "authorized": false,
    "mode": "never",
    "approval_kind": "none",
    "approval_head_sha": null,
    "auto_merge_opt_in": false,
    "branch_protection_bypassed": false
  },
  "protected_path_touched": false,
  "required_checks": [
    {
      "name": "test",
      "conclusion": "success",
      "head_sha": "bbbbbbbbbbbbbbbbbbbbbbbbbbbbbbbbbbbbbbbb"
    }
  ],
  "action_digest_required": true,
  "decided_at": "2026-07-27T23:10:00Z",
  "decision_digest": "511d2ed0547ecdc1e7f7dcb966481bbc84e0aba878c3d14339d3438505decdd8"
}
